{
  "version": "1.1",
  "metadata": {
    "description": "AI-Protocol v1.1 - Standard Specification for AI Model Integration",
    "last_updated": "2026-01-31",
    "release_version": "1.1.1",
    "authors": [
      "AI-Protocol Team"
    ],
    "license": "MIT OR Apache-2.0"
  },
  "standard_schema": {
    "parameters": {
      "temperature": {
        "type": "float",
        "range": [
          0,
          2
        ],
        "default": 1,
        "description": "Controls randomness in the output"
      },
      "max_tokens": {
        "type": "integer",
        "min": 1,
        "max": 32768,
        "description": "Maximum number of tokens to generate"
      },
      "stream": {
        "type": "boolean",
        "default": false,
        "description": "Enable streaming responses"
      },
      "top_p": {
        "type": "float",
        "range": [
          0,
          1
        ],
        "default": 1,
        "description": "Nucleus sampling parameter"
      },
      "frequency_penalty": {
        "type": "float",
        "range": [
          -2,
          2
        ],
        "default": 0,
        "description": "Penalize frequent tokens (OpenAI-compatible)"
      },
      "presence_penalty": {
        "type": "float",
        "range": [
          -2,
          2
        ],
        "default": 0,
        "description": "Penalize repeated presence (OpenAI-compatible)"
      },
      "top_k": {
        "type": "integer",
        "min": 1,
        "max": 500,
        "description": "Top-K filtering (Gemini/open-source compatible)"
      },
      "stop_sequences": {
        "type": "array",
        "description": "Stop sequences to truncate generation"
      },
      "logprobs": {
        "type": "boolean",
        "default": false,
        "description": "Return token logprobs when provider supports"
      },
      "top_logprobs": {
        "type": "integer",
        "min": 1,
        "max": 5,
        "description": "Number of top logprobs to return"
      },
      "seed": {
        "type": "integer",
        "description": "Deterministic seed when supported"
      },
      "tool_choice": {
        "type": "string_or_object",
        "values": [
          "auto",
          "none",
          "required",
          "specific"
        ],
        "default": "auto",
        "description": "Tool choice policy per request. Runtimes SHOULD accept either a simple string policy (auto/none/required) or a provider-specific object (e.g., OpenAI tool_choice object for selecting a specific tool).",
        "object_shape": {
          "description": "Minimum object contract when tool selection is explicit.",
          "fields": {
            "type": {
              "type": "string",
              "values": [
                "function",
                "tool"
              ],
              "required": true
            },
            "name": {
              "type": "string",
              "required": true,
              "description": "Function/tool name to invoke when type indicates a specific tool."
            },
            "id": {
              "type": "string",
              "required": false,
              "description": "Provider-specific tool identifier when available."
            }
          }
        }
      },
      "response_format_mode": {
        "type": "string",
        "values": [
          "auto",
          "text",
          "json_object",
          "json_schema"
        ],
        "default": "auto",
        "description": "Structured output selection (OpenAI Responses / JSON mode)"
      },
      "reasoning_effort": {
        "type": "string",
        "values": [
          "low",
          "medium",
          "high",
          "auto"
        ],
        "default": "auto",
        "description": "Reasoning effort for agentic tasks"
      }
    },
    "tools": {
      "schema": "standard_tool_definition",
      "choice_policy": [
        "auto",
        "none",
        "required",
        "specific"
      ],
      "strict_mode": true,
      "parallel_calls": true
    },
    "response_format": {
      "types": [
        "text",
        "json",
        "structured"
      ],
      "schema_validation": true
    },
    "multimodal": {
      "image": {
        "formats": [
          "png",
          "jpeg",
          "gif",
          "webp"
        ],
        "max_size": "10MB"
      }
    },
    "agentic_loop": {
      "max_iterations": 10,
      "stop_conditions": [
        "tool_result",
        "final_answer"
      ],
      "reasoning_effort": "auto"
    },
    "streaming_events": {
      "supported_events": [
        "PartialContentDelta",
        "ThinkingDelta",
        "PartialToolCall",
        "ToolCallStarted",
        "ToolCallEnded",
        "StreamError"
      ],
      "thinking_blocks": true,
      "citations_enabled": true,
      "transport_definitions": {
        "sse": {
          "description": "Server-Sent Events (SSE) framing contract used by multiple providers.",
          "framing": {
            "delimiter": "\\n\\n",
            "data_prefix": "data: ",
            "done_signal": "[DONE]"
          },
          "notes": [
            "Runtimes should split frames by delimiter and parse each data payload as JSON when applicable.",
            "Providers MAY emit non-data lines; runtimes should ignore unknown lines unless a provider-specific decoder.strategy says otherwise."
          ]
        }
      },
      "termination_reasons": {
        "standard_reasons": [
          {
            "id": "end_turn",
            "description": "Model reached a natural stopping point."
          },
          {
            "id": "max_tokens",
            "description": "Generation stopped because max tokens or context constraints were hit."
          },
          {
            "id": "stop_sequence",
            "description": "Generation stopped because a user-provided stop sequence was encountered."
          },
          {
            "id": "tool_use",
            "description": "Model decided to invoke one or more tools / function calls."
          },
          {
            "id": "refusal",
            "description": "Model refused or safety classifiers intervened (policy)."
          },
          {
            "id": "pause_turn",
            "description": "Turn was paused and may be continued in a subsequent request."
          },
          {
            "id": "other",
            "description": "Provider-specific or unknown termination."
          }
        ]
      }
    },
    "telemetry": {
      "principles": [
        "Telemetry MUST be opt-in. Runtimes MUST NOT force collection or transmission.",
        "Generation and feedback reporting MUST be decoupled; feedback is asynchronous and may be dropped.",
        "Data minimization is required. Prefer ids, indices, and hashes over raw prompt/output text.",
        "A stable request_id (client-generated if necessary) is REQUIRED for closed-loop linkage."
      ],
      "feedback_events": {
        "ChoiceSelection": {
          "description": "User selection among multiple candidates (n > 1).",
          "fields": {
            "request_id": {
              "type": "string",
              "required": true,
              "description": "Runtime-generated request identifier used for linkage (not necessarily provider's request id)."
            },
            "chosen_index": {
              "type": "integer",
              "required": true,
              "description": "0-based index of the chosen candidate."
            },
            "rejected_indices": {
              "type": "array",
              "items": "integer",
              "required": false,
              "description": "Optional list of 0-based indices that were shown but not chosen."
            },
            "latency_to_select_ms": {
              "type": "integer",
              "required": false,
              "description": "Time from rendering candidates to the user making a selection (milliseconds)."
            },
            "ui_context": {
              "type": "object",
              "required": false,
              "description": "Optional UI / experiment context (A/B bucket, component, etc.)."
            },
            "candidate_hashes": {
              "type": "array",
              "items": "string",
              "required": false,
              "description": "Optional hashes for the rendered candidates; enables audit/linkage without uploading full text."
            }
          }
        },
        "provider_mappings": {
          "anthropic": {
            "source_field": "stop_reason",
            "notes": [
              "Non-streaming: stop_reason is always non-null.",
              "Streaming: stop_reason is null in message_start, then non-null otherwise."
            ],
            "map": {
              "end_turn": "end_turn",
              "max_tokens": "max_tokens",
              "stop_sequence": "stop_sequence",
              "tool_use": "tool_use",
              "pause_turn": "pause_turn",
              "refusal": "refusal"
            }
          },
          "openai": {
            "source_field": "finish_reason",
            "notes": [
              "finish_reason is reported per candidate."
            ],
            "map": {
              "stop": "end_turn",
              "length": "max_tokens",
              "tool_calls": "tool_use",
              "content_filter": "refusal",
              "null": "other"
            }
          }
        },
        "runtime_behavior": [
          "Runtimes SHOULD surface standardized termination reasons to users and logs.",
          "Runtimes SHOULD preserve the original provider-specific reason in extra metadata for debugging."
        ]
      },
      "event_definitions": {
        "StreamError": {